"hermoso hotel....debes conocerlo y tomarte un café con oro por experiencia, no necesitas hospedarte, solo ve y disfruta. Date una vuelta por las fuentes que es ...",5.0,Emirates Palace,4.5
"Imperdible aunque estes hospedado en Dubai, toma un tour ida y vuelta, no lo dejes pasar, extraordinario, vale muchísimo la pena, no dejes de ir, cuesta como 67...",5.0,Mezquita Sheikh Zayed,5.0
"15 minutos esperando a que nos recibieran auto estacionamiento , ni el del valet parking se acercó jamás",1.0,QK BRISAS,3.5
"Muy bueno y nada caro, muy atentos...solo recomendaría no decir que esperemos 30 o 45 min para obtener mesa, pasamos antes de 15min y así ya no te vas a otro la...",4.0,Ajijic Tango,4.5
"Aunque se oye todo lo qué pasa en la calle la habitación ""las olas"" de las más bonitas que me ha tocado y visto al mar excelente. La playa de los muertos a 1min...",4.0,Amor Boutique Hotel,4.0
"Agua cristalina, naturaleza espectacular, gente muy atenta la de las lanchas. Visitar playa larga en el mismo recorrido de playa amor. Lancha privada mejor y an...",5.0,Islas Marietas,4.5
Maravillosa atención al huésped. Cuidan cada segundo de tu estancia y una sonrisa en cada uno del personal. Nos sorprendió el detalle de nuestro aniversario y e...,5.0,Secrets Vallarta Bay Todo Incluido,4.5
