"A qui puedes encontrar recuerdos realmente baratos de dolar, el refresco de lata por dolar, sin embargo hay mucha gente drograda y muchos muchos indigentes. Rea...",4.0,Fremont Street Experience,4.0
"La strip es la calle que se visita en las vegas, la cual cuenta con los hoteles mas lujosos o tematicos. Para recorrerla practicamente tienes que ir caminando,...",5.0,The Strip,4.5
"Yo pedi un burrito y me costo 8 dls mas el impuesto, y solo me comi la mitad, de hecho tienen muchos desechables por que la gente no se termina lo que te sirven...",5.0,Mr. Mamas,4.5
"Es un buen transporte, cuesta 8 dls por persona por 24 hrs, recomiendo comprar el de 3 dias, por que las distancias entre cada hotel son grandes y engañozas, pu...",4.0,The Deuce,4.5
"Les recomiendo reservar este hotel por que esta muy bien ubicado, para un precio mas económico lo encuentran directamente en la pagina del hotel y previamente l...",5.0,Flamingo Las Vegas Hotel & Casino,3.5
"Lo Peor: Mi hijo de 3 años encontró una bolsa de Marihuana en el tocador el primer dia al llegar a la habitación, se reportó, pidieron disculpas pero sentí qu...",4.0,Meliá Cozumel Golf - All Inclusive,4.0
LO BUENO: -tiene area para niños con alberca y juegos; ademas un otro barco pirata de piso -todo el tiempo el agua de la alberca esta calientita y limpia -buena...,4.0,Emporio Ixtapa,4.5
"Es un hotel que se encuentra lejos del aeropuerto, y no tiene camionetas del propio hotel que te recojan, ya una vez dentro no hay necesidad de salir y tampoco ...",5.0,Grand Palladium Vallarta Resort & Spa,4.0
"bonita ex`peiriencia en el lugar para salir de lo cotidina de la ciudad, pueden ir se los recomiendo ampliamanete",4.0,Islas Marietas,4.5
