Este restaurante debería tener un par de estrellas Michelin. Los chefs tienen la disciplina en su platos adquirida en el Bulli.... Verdaderamente la cocina es ...,5.0,Noso,4.0
Pocas veces me había tocado tan buen servicio como en Miramar. Para mi una extraordinaria opción para una estancia romántica en Puerto Vallarta. Tiene una de...,5.0,Grand Miramar All Luxury Suites & Residences,4.5
Uno de los lugares más bellos del mundo. Hay que reservar. Por la demanda que hay solo dejan entrar a 100 personas diarias,5.0,Islas Marietas,4.5
The bathtub floor is very slippery when wet (my wife slipped and injured her leg). The hotel manager and staff where very helpfull and responsive We hired the...,5.0,Heritage Adventures,5.0
It is the most amazing piece of Mexican Barroque Decoration I have ever seen. It is really breath taking,5.0,Iglesia de Santa Maria Tonanzintla,5.0
"It's really very poor quality food. There are many other options better than this. We ate here a Spaghetti Marinara and got sick, the Raviolli where lousy. Th...",1.0,Cus Cus Cus,4.0
"My wife and I where there on our honeymoon. It has an extraordinary ambiance, food, location. The owners really have put a lot of attention to every single det...",5.0,"Governor's Residence, A Belmond Hotel, Yangon",4.5
"We stayed for 3 nights on this extraordinary hotel. Bathrooms are hand painted, with incredible details on every corner. Service was excepcional and food was ...",5.0,Inle Princess Resort,4.5
"I stayed there with wife and 6 kids. Sergio rented us the Villa. It's a 4 room beautifully decorated Villa with it's own Palapa, full functioning kitchen. I wo...",5.0,Hotel Paraiso Escondido,4.5
