Por las mañanas nos (muy temprano) ivamos a caminar en compania de mi esposa y disfrutamos mucho la platica disfrutando de lbuen tiempo.,4.0,Playa de los Muertos,4.5
"Visitamos, como buen catolico, la parroquia y estivimos admirando los retablos y las imagenes esto fue por la noche",4.0,Parroquia de Nuestra Señoora del Refugio,4.5
"No puede faltar, las compras en este lugar fenomenal como paseo y paraiso para compras de las mujeres.",4.0,Isla del Río Cuale,4.5
"Todas las trdes saliamos a caminar por el malecon, el cual gOza de una limpieza excelente y un clima muy agradable. Lleno de tiendas y locales muy bien arreglad...",5.0,Malecón Boardwalk,4.5
"Increible, fue toda una aventura nadar de la envarcación a la hisla, aproximadamente 150 metros el mar y despues relajarte en la playa que esta dentrode una cav...",5.0,Islas Marietas,4.5
"Despues de viajar en un autobus urbano con muchas paradas y gente muy amable, nos recomendaron bajar en bucerias. Que lugar tan tan bonito. Muchisima playa y un...",4.0,Bucerías,40.4
"Muy bueno todo, muy sabroso y una excelente atención, el lugar agradable y una excelente ubicación, sin problemas de estacionamiento",4.0,Mariscos Tino's,4.0
