"Ame este lugar, desde que empeizas a caminar para llegar a el lo hace encantador. Al entrar no esperes encontrar lujos, es un lugar sumamente sencillo pero con ...",5.0,S caffecito,4.5
"Jardines es un lugar incomparable para los amantes de las plantas y paisajes, solo que tienes que ir preparado para caminar muchisimo (no tacones), hay carritos...",5.0,Jardines de M칠xico,4.5
"Es un balneario cl치sico, en donde encuentras infinidad de albercas para cada gusto, toboganes, 치reas verdes, es inmenso y muy barato, si quieres un lugar bonito...",4.0,Issstehuixtla,4.0
Xplor te garantiza diversi칩n y adrenalina al 100% Compren sus entradas y fotos por internet porque les saldr치 m치s econ칩mico. De preferencia con m치s de 20 d칤as ...,5.0,Xplor,4.5
"No pueden irse de Akumal sin visitar este lugar tan bonito. La vista es incre칤ble, la comida muy rica y los tragos pfffff 游눛. El ceviche de camar칩n esta riqu칤...",5.0,La Buena Vida,4.5
"Desde el momento en que llegas amas Xcaret, es un parque lleno de vida!! Eso si prep치rense para caminar y caminar sin parar. Les recomiendo comprar sus pases ...",5.0,Parque Xcaret,4.5
"El hotel es muy bonito y la ubicaci칩n es perfecta! Porque te queda casi todo a 15min Xplor, Xcaret, Playa del Carmen, Tulum, AKumal... Etc! Todo est치 s칰per cerc...",5.0,Barcelo Maya Caribe,4.5
"El hotel esta incre칤ble! Las instalaciones, recamaras, jardines! Todo de primera!!! Me encanto! El 칰nico detalle es que no tiene playa y tienes que ir a la pl...",4.0,Mayan Palace Acapulco,4.0
"Un lugar sencillo pero la comida muy rica! Prob칠 la pasta marinera y pfff 游녧 esta s칰per buena! Tiene un toque pocosito rico, yo le agregue queso gorgonzola porq...",4.0,La Pizza Della Nonna,4.5
La pizza mediterr치nea con pulpo y camar칩n!!!! Que cosa mas deliciosaaaaa!!!! Y el queso ni se diga! Es una de las pizzas mas grasosas que he comido jaja pero va...,4.0,Restaurante 1900,4.0
Simplemente me encanta!!! Les recomiendo ir en bola con amigos y as칤 para que pidan canciones y no les salga tan caro porque cada canci칩n vale $100 y no te pued...,5.0,Cantina La Coyoacana,4.0
"Desde antes de llegar a la playa empieza la aventura porque esta toda iluminada de velas y se ve super bonito! El espect치culo te mueve todo, la m칰sica, el ves...",5.0,Rhythms of the Night by Vallarta Adventures,4.5
"Muy padre para irte a dar una vuelta por la noche, esta lleno de bares y restaurantes. Hacen unas figuras con arena muy bonitas y puedes picar un poco de todo, ...",3.0,Malec칩n Boardwalk,4.5
"El lugar sencillo pero la idea bastante buena, me encanto mi recamara! Era habitaci칩n doble con vista a la calle, ten칤a una litera muy coqueta, el ba침o fue lo q...",4.0,Kuku Ruku Queretaro,4.0
"El lugar es peque침o pero muy bonito, la comida deliciosa!!! Les recomiendo los tacos de chapulines y la tlayuda pfffff!!!!",5.0,Maria y su bici,3.5
"Es un tour 1000% Adrenalina, con infinidad de actividades desde pasar caminando por una cuerda, rappel, hasta la tirolesa superman que esta increible!! Hay dife...",5.0,Vallarta Adventures,4.5
"La playa esta muy padre, el unico detalle es que el agua esta helada!!!! Horrible jajaj sufres un poco porque solo puedes entrar a la isla nadando, pero vale la...",5.0,Islas Marietas,4.5
Un viaje para hacerlo tu solito! Y si vas en pareja con mayor raz칩n. Es mucho m치s divertido ir por tu cuenta y por mucho mas barato!!! Tomas una lancha taxi e...,5.0,Yelapa Waterfalls,4.0
"Las habitaciones necesitan remodelaci칩n sin embargo la limpieza en ellas es muy buena. Lo que me encanto fueron las albercas,los jardines, la vista es increible...",4.0,Princess Mundo Imperial,4.0
"La comida es deliciosa, la ubicaci칩n me encantom tienen amacas donde puedes reposar despu칠s de haber comido, un 치rea para ni침os muy bonita, ba침os limpios lo cua...",5.0,Playa Barra Vieja,4.5
