"Las masajistas son súper profesionales y atentas, el masaje súper delicioso. María (quien está encargada de la recepción) tiene una conversación muy amena. Adem...",5.0,Day Spa,4.5
"Cabe resaltar que Fredy's es un lugar muy conocido, por lo que, en las horas pico hay mucho movimiento y poco lugar. Sin embargo, ofrecen café durante la espera...",5.0,Fredys Tucan,4.5
"Colomitos es una buena opción si quieres conocer una playa semi-virgen, es pequeña, de agua color turquesa, oleaje bajo (dependiendo la posición de la luna) y e...",5.0,Colomitos,4.0
"Cada uno de los platillos son una delicia, están bien servidos e incluso se pueden compartir los platos fuertes ya que tienen una buena ración. Las entradas son...",5.0,Porto Bello Bistro & Lounge,4.5
"Calles empedradas, una pequeña civilización. Pasear por el malecón es cultura. Aunque las playas son muy sucias, siempre está la opción de ir a Mismaloya o a Na...",5.0,Playa Nuevo Vallarta,4.5
"El servicio es regular, siempre hay mucha gente por lo tanto es normal que el servicio sea tardado. Excelente lugar, desde el tercer piso tiene una buena vista ...",5.0,Barcelona Tapas Puerto Vallarta,4.5
"Además de encontrar absolutamente todo (desde restaurantes hasta souvenirs) es un excelente lugar para caminar, relajarse, tener entretenimiento e incluso tener...",5.0,Malecón Boardwalk,4.5
"Es un lugar súper delicioso y demasiado romántico para una cita. Los meseros son lindos y amables, muy atentos. Una experiencia inolvidable para la memoria y el...",5.0,La Palapa Restaurant,4.5
"Uno que siempre vivió en mar respeta la naturaleza para poder apreciarla. Pör favor viajeros, sean concientes... cuando vayan a las marietas sean responsables c...",5.0,Islas Marietas,4.5
"Tiene muy pocos toboganes pero es divertido para pasar un rato agradable. La comida es cara, mala y escasa, es por eso que no califico 5 estrellas.",4.0,Aquaventuras Park,4.0
