"Situated in a historic neighborhood and surrounded by beautiful Craftsman homes, this amazing park is just 3 minutes from Downtown Spokane. It features an amazi...",5.0,Parque Manito,5.0
This is our 4th stay and we would recommend it our friends and family!! Love the walkability and quiet location on the river. Our room was beautiful. Only staye...,5.0,Rivera del Rio Boutique Hotel,5.0
This is our 4th stay and we would recommend it our friends and family!! Love the walkability and quiet location on the river. Our room was beautiful. Only staye...,5.0,Rivera del Rio Boutique Hotel,5.0
"My wife and I have been traveling to Sayulita for 15 years or so, sometimes twice a year. One of my favorite things to do is an early morning walk into the town...",5.0,ChocoBanana,4.5
Italia Trattoria is a true hidden gem situated in the hear of Historic Browne's Addition. Experienced staff make for wonderful dining and the all local fresh in...,5.0,Italia Trattoria,4.5
"I am a local Spokanite, born and raised here and have logged hundreds of miles on this beautiful trail! From Riverside State Park running through beautiful Rive...",5.0,Centennial Trail,4.5
"One if our favorite places to just hang out, have a drink, people watch and smile. Great central location. Excellent pizza and fresh salads.",5.0,La Rústica Sayulita,4.5
"One if our favorite places to just hang out, have a drink, people watch and smile. Great central location. Excellent pizza and fresh salads.",5.0,La Rústica Sayulita,4.5
"Sayulita is our happy place, we have traveled there around seventeen times in the last 15 years or so. Stayed at several private homes, casitas and boutique hot...",5.0,Sayulita Beach,4.0
"Sayulita is our happy place, we have traveled there around seventeen times in the last 15 years or so. Stayed at several private homes, casitas and boutique hot...",5.0,Sayulita Beach,4.0
"If you want a great experience visit Downtown Spokane. It has so much to offer. Some of my favorite activities are the great restaurants, River Park Square with...",5.0,Downtown Spokane,4.0
My wife and I have made the trip from Spokane to Portland many times and never stopped by to see this beautiful property. What an amazing setting overlooking th...,5.0,Columbia Gorge Hotel,4.5
"The flying Goat is consistently great. My wife and I and sister in law enjoyed two pizzas, Caesar salad and Flying Goat Red Blend wine.",5.0,The Flying Goat,4.5
"Never disappointing. A consistent and top notch delight. You won’t be disappointed from the appetizers to the desert, superb service. You must check this place ...",5.0,Wild Sage American Bistro,4.5
La Rustica Sayulita is a wonderful addition to the great variety of dining experiences in Sayulita. The staff were friendly and attentive. The food is outstandi...,5.0,La Rústica Sayulita,4.5
La Rustica Sayulita is a wonderful addition to the great variety of dining experiences in Sayulita. The staff were friendly and attentive. The food is outstandi...,5.0,La Rústica Sayulita,4.5
"Sayulita Beach is a magical place that affords travelers both excellent surfing, people watching and beach walking. Stop by a small local bar for a margherita o...",5.0,Sayulita Beach,4.0
"Sayulita Beach is a magical place that affords travelers both excellent surfing, people watching and beach walking. Stop by a small local bar for a margherita o...",5.0,Sayulita Beach,4.0
"My wife and I have traveled to Sayulita Mexico over 15 times. We feel like it is a home away from home. Casablanca is clean, very well located about mid way up ...",5.0,Beach Front Hotel - Casablanca Sayulita,4.5
El Make on Boardwalk is within walking distance of Hotel Rivera del Rio. You can walk along the River and cross swinging bridges and through an area where The ...,5.0,Malecón Boardwalk,4.5
"We rented a small boat with a few friends and motored our way through the bay out to the islands. We say flying fish, Sea Turtles, porpoise and whales. Excellen...",5.0,Islas Marietas,4.5
"Fabulous in every way. The staff and management were amazing. Would definitely go back again. They greet you with fresh wash clothes, Margaritas, and chips and ...",5.0,Rivera del Rio Boutique Hotel,5.0
"Fabulous in every way. The staff and management were amazing. Would definitely go back again. They greet you with fresh wash clothes, Margaritas, and chips and ...",5.0,Rivera del Rio Boutique Hotel,5.0
