"Una estancia muy agradable. El personal muy amable y atento con nosotros, los desayunos deliciosos y a muy buen precio. Las habitaciones muy cómodas que te hará...",5.0,Casa Blat Ha,4.5
Un lugar muy agradable al costado de la laguna. El trato fue muy amable y eficiente. Cabe mencionar que el lugar estaba vacío. La comida con buen sazón y los ma...,4.0,The Blue Shrimp Nuevo Vallarta,4.5
Palapa a orilla de la Playa el Borrego en San Blas. Platillos con un buen sazón de mariscos. La relación calidad-precio es la exacta y además aceptan pago con t...,4.0,Restaurant Caballito del Mar,4.0
"Sin duda uno de los lugares ecológicos más hermosos que ofrece nuestro país. El tour es agradable a la vista, además de ser ultra relajante. Una excelente forma...",5.0,Manantial La Tovara,4.5
Los mejores tacos que he probado hasta el momento en Bahía. Precio justo por el sabor. Trato amable y eficiente!!!! Sin duda regreso pronto!!,5.0,Sonorita,3.5
Muy buen sabor y la relación calidad-precio es la adecuada. La atención fue rápida y precisa. Altamente recomendados!!,5.0,Pancho's Takos,4.5
"Un hotel muy completo, los servicios excelentes, la habitación muy bien equipada. Las instalaciones muy bien conservadas y los animales en cautiverio son un bue...",5.0,Occidental at Xcaret Destination,4.0
