"La semana pasada fuimos a por tercera vez a Puerto Vallarta! Siempre que íbamos nunca saliamos del hotel, porque siempre ibamos a todo incluido! Pero esta sema...",5.0,Hotel Porto Allegro,4.5
Pésimo lugar! nos lo recomendaron pero el agua esta toda cochina! y hay mucha gente!! y no puedes estar agusto! si,1.0,Playa de los Muertos,4.5
"Pues esta mas o menos, lo malo es que tienes que caminar mucho para poder subirte a todos los toboganes y ni estaban abiertos todos, lo que si la comida super r...",5.0,Aquaventuras Park,4.0
"Fue la mejor experiencia y lo mejor del viaje!! Aunque no este abierta la playa del amor, la nopalera, el snorkel y el kayak es lo mejor! se ve hermoso lo prom...",5.0,Islas Marietas,4.5
Despues de un dia largo en este lugar puedes pasar tiempo en familia! en el show y ver un hermoso atardecer!:),5.0,Malecón Boardwalk,4.5
Lo malo es que hay muchos turistas y no puedes verla muy bien pero si te acercas esta muy hermosa!!!,4.0,Parroquia de Nuestra Señora de Guadalupe,4.5
Esta no es la mejor playa publica para nada! El agua esta muy sucia! y pues como es publica hay demasiada gente!,1.0,Los Muertos Pier,4.5
