es un pequeño hotel pero muy acogedor buen servicio el cuarto comodo y buen desayuno es una buena opcion para un hotel que solo necesitas bed and breabfast u...,4.0,Cape Standard,4.5
"La pase super lindo la comida riquisima ,tla atencion de primera tanto en la recepcion como en el restaurant las habtaciones super lindas realmente un lindo ho...",4.0,JW Marriott El Convento Cusco,5.0
"tomamos unos chilcanos y tapas , el sitio muy agradable buen ambiente con musica en vivo los tragos y comida muy buena buenos precios",4.0,Museo del Pisco,4.5
"un lindo lugar para visitar cuando vas a panama la gente es amable , yo fui de campamento de un dia a otro tambien se puedes ir a pasar el dia",4.0,Islas San Blas,4.5
"este hotel es ahora el perla inn. muy linda la playa, tranquila y pequeña , la atencion es muy buena la gente amable y la comida basante buena para lo reducido ...",4.0,Mar & Oro,3.5
"el mejor restaurant de la zona la comida es pizzas y pastas, el dueño te dicce que ha cocinado ese dia normalmente su opcion es italiana la comida y decoracion ...",4.0,Casa Tortuga Cucina Creativa,4.5
yo fui al que da a la playa ya que el otro esta un poco alejado y es un poco pequeño el servicio del que no esta en la playa no es muy bueno pero el que esta en...,4.0,Perla Real Inn,4.0
realmente la pasamos super bien la habitacion amplia y comoda la comida de los restaurants muy buena los bares y discotecas tambien buenos con excelente vista e...,4.0,Hard Rock Hotel Panama Megapolis,4.5
"comimos muy rico ,el cheff es peruano la atencion muy buena y el lugar muy lindo realmente la pasamos excelene es muy buena opcion",4.0,Soy,4.0
"excelente opcion para cenar, lugar muy acogedor, comida muy buena y la atencion de primera de los meseros Jorge y carlos ademas era mi aniversario y me trajeron...",4.0,Café des Artistes,4.5
"la verdad que comimos riquisimo, el lugar super acogedor y original, realmente un lugar para no dejar de ir",4.0,La Leche,4.5
bonito lugar para caminar y comer algo la zona de la playa tiene un poco de piedras en la orilla pero al costado se encuentra la playa de los muertos ahi no ha...,3.0,Zona Romántica,4.5
ideal para estar en la noche y caminar encuentras restaurants bares tiendas de artesanias buen movimiento para la noche,4.0,Malecón Boardwalk,4.5
"lindo paseo, el servicio y atencion del ferry muy buena, la isla muy linda realmente se pasa un lindo dia",4.0,Islas Marietas,4.5
"fui con mi familia y unos amigos y la verdad la pasamos muy lindo, el hotel tenia una linda vista y muy tranquilo, los bungalows amplios y comodos la verdad que...",3.0,O'Pal Sierra Resort,4.0
