"La playa, sencillamente es hermosa, mis hijos y yo verdaderamente disfrutamos este lugar... Primero tenía cierto temor por lo qie había escuchado del lugar, per...",4.0,Sayulita Beach,4.0
Hermoso lugar... Aunque muy fría el agua... Muy recomendable para visitar con la familia y amigos... Debes visitarlo cuando estés es Colima...!!!,4.0,Balneario Agua Fría,4.0
La cerdad vale la pena visitar eate lugar... Comida excelente y un agradable ambiente... Sin duda un lygar al que no debes faltar...!!!,4.0,Los Molcajetes de Villa,4.5
"Debes visitar ""La Casa de Piedra"", ambiente muy agradable y limpio. Vale la pena que des una vuelta y disfrutes de su comida.",4.0,La Casa de Piedra,4.0
"Hola amig@s... Este es realmente un buen lugar para la convivencia familiar, ya que podemos pasar todo un día sin sentir que tenemos tanto tiempo en el zoológic...",4.0,Zoológico Guadalajara,4.5
"Es un lugar muy tradicional en Mazatlán... excelente ambiente, buena música de banda, increíble comida (Molcajete muchacho alegre)... Si visitas Mazatlán, debes...",4.0,El Muchacho Alegre,4.0
"La verdad es que tienes una vista increíble de la playa... Ahí encontraras un verdadero tesoro, como son las mujeres mazatlecas y muuuuucho@s turístas... Debes...",4.0,Malecón de Mazalán,4.5
"Si buscas una opción económica, seguro, en la mejor playa... Tu opcion es Fontan Ixtapa... Altamente recomendable... Cerca de oxxo, mercado de artesanias, plaza...",4.0,Hotel Fontan Ixtapa,4.0
"Sinceramente no conozco una ciudad tan limpia como Colima... Además si clima caluroso lo hace increíblemente hermosa, con gente amable, sincera y muy servicial....",5.0,Colima Capital,4.0
"Simplemente maravilloso... Tranquilo, agradable, buen servicio... Sin duda, muy recomendable... Extraordinarios shows, comida deliciosa, bebidas aceptables... T...",5.0,Royal Decameron Complex,4.0
"Simplemente hermoso el hotel, sus intalaciones, restaurante, albercas y sobre todo su playa increible... Definitivamente super recomendable para descansar... Vi...",5.0,Decameron Los Cocos,4.0
"Visita Colima, simplemente hermosa la ciudad... Tranquila, limpia, calorsito, buena gente... Prueba el tejuino, la tuba, el bate, tostadas de cuerito... Animate...",5.0,Ciudad de Colima,4.0
Simplemente es un lugar espectacula... De los lugares que debes visitar sin dudarlo... Imperdible...!!!!!!!!!!!,5.0,Parque Xcaret,4.5
"Un lugar muy hermoso... La iglesia, simplemente espectacular, y con el mar caribe de fondo... Visitala...!!!!!!",4.0,Quinta Avenida,4.0
"Estuve en este paraíso hace 2 semanas y la verdad quedé bastante contento... Lo único que les digo es que visiten este hotel... Playa espectacular, excelente co...",4.0,Sandos Playacar,4.5
"Vivo a 20 min. Y le he visto todos los días durante 30 años... Espectacular en enero, ya que se cubre de nieve junto con el Nevado de Colima..",5.0,Volcán de Colima,4.5
"El pasado fin de semana tuve la oportunidad de visitar este hotel, la verdad es que quede de lo mas satisfecho. Super cómoda la habitación, buen servicio, en fi...",4.0,Hotel Zar Manzanillo,3.5
"El agua esta de lo mejor en esta temporada, muy familiar, si quieres divertirte visitala... no te arrepentirás...",5.0,Playa Miramar,4.5
La verdad es que es toda una aventura la visita al Nevado de Colima... solo debes tener cuidado al regreso... muchos carros se quedan sin frenos...,5.0,Nevado de Colima,4.5
La verdad es un lugar... para mí impresionante y maravilloso. En la visa me imaginé poder visitar algo tan hermoso... simplemente es imperdoble si visitas Puert...,5.0,Islas Marietas,4.5
