desconocido,40.4,No obtenido,
"Deben mejorar la comida,hacerla mas variada e internacional en el buffet y desayuno.Deberia haber un frigobar en la habitacion,La atencion es buena y se destaca...",3.0,Plaza Pelicanos Club Beach Resort,4.0
"Es espectacular el paisaje el agua y las actividades para hace yo las hice con Adventure y fui a unos lugares hermoso , solo hay q tener cuidado con las agua vi...",5.0,Vallarta Excursions,5.0
"la pase genial e hice todas las actividades,volveria a ir,fui se puede ir en flia o pareja o solo,Se recomienda",5.0,Islas Marietas,4.5
"Es muy lindo caminar por rl malecon y ver su cultura, es importantisimo es tener en cuenta q se puede caminar tarquilo a cualquier hora del dia,eso es genial , ...",5.0,Malecón Boardwalk,4.5
"Espectacular lugar, muy buena la empresa Turismo Adventure cumplieron cn todo lo pactado la comida excelente la actividades tambien ,y el personal muy calido",5.0,Vallarta Adventures - Las Caletas Beach Hideaway,4.5
