"La atención de la recepcionista matutina de lo mejor, atenta, amable y dispuesta a resolver de manera fácil e inmediata las peticiones, el chico de la tarde era...",4.0,Flamingo Vallarta Hotel & Marina,4.0
De los mejores atardeceres que he visto!!! la gente amable a pesar de ser un viaje de negocios y ser día lunes el lugar parece un carnaval!!,5.0,Malecón Boardwalk,4.5
"Recomiendo Totalmente visitarla , el recorrido fue muy bueno el clima fue de lo mejor nos toco avistar ballenas, les sugiero abordar El ""BAHÍA ALEGRE"" muy buena...",5.0,Islas Marietas,4.5
"Excelente Atención, tuve un problema con la regadera marque y a la brevedad se presento el staff de mantenimiento, el personal de restaurante amable en todo mom...",5.0,Grand Oasis Palm,4.0
"de lo mejor, la distribución todo cuidado al detalle, la logística como todo deja un poco que desear pero en general excelente lugar y los colaboradores atentos...",4.0,Centro de Convenciones de Cancún,4.0
"lo mejor para buscar algún Souvenir, con materias primas de la región a una excelente costo, Existen muñecas en varios locales con nombre de nuestros antepasa...",5.0,Mercado 23,4.0
