"Ostello Bello Grande is quite simple without comparition. Clean, affordable, full of amenities, a lovely place to have an aperitif, close to the station... The ...",5.0,Ostello Bello Grande,4.5
"Quite good! I deeply recommend it, a particular highlight is the visit to the last supper alternate, a nice visit from Roman time to modern time.",5.0,FollowMi Around,5.0
"Pepe y su familia dan una atención magnifica, y ofrecen tours incomparables. Con un grupo de amigos fuimos a la Isla de San José y estuvo pendiente desde antes ...",5.0,Barbarita Tours,5.0
Cuando uno va de visitas a california por los parques generalmente es difícil escoger debido a la gran oferta. Knotts por ejemplo se ve opacado por Disneylandia...,4.0,Knott's Berry Farm,4.0
"Definitivamente el mejor lugar para las fotos de facebook. Los Moais se montan sobre una plataforma de carácter sagrado, por lo que la isla tiene espacios delim...",5.0,Rano Raraku,5.0
Las Marietas son una experiencia increible pero complicada: a veces el mar no coopera y tiene o medusas o marea alta/oleaje que impide/dificulta entrar a la isl...,5.0,Islas Marietas,4.5
"Los empleados son de lo más amables y accesibles, la atención muy puntual. Lo mejor: El SPA. Buen precio y Excelente servicios. Ha sido el mejor masaje (escogi...",4.0,Costa Sur Resort & Spa,4.0
