"El lugar muy c贸modo, el servicio muy bueno, la presentaci贸n, sabor y calidad excelente!! Pero en lo personal las porciones son muy chicas-peque帽as- insuficiente...",4.0,Barrio Shibuya,4.5
"Fui a probar las Tlayudas!! Est谩n muy ricas, pero su costo es algo alto, porqu茅 son Tlayudas, pues? Regrese a probar el desayuno y me encant贸!! El chocolate e...",4.0,Pasillo de Humo,4.5
Una carta muy muy basta que quieres todo!! Lo bueno para la gente poco conocedora de comida japonesa-tailandesa etc茅tera es que viene con im谩genes cada platillo...,4.0,Mog Bistro,4.5
"Me encanta! Es una de las opciones saludables m谩s accesible 梆, puedes desayunar, comer o cenar por 120-160 pesos. Recomiendo la ensalada Mona Lisa い y el...",4.0,Frutos Prohibidos Condesa,4.0
"Me encant贸! La atenci贸n, el lugar que aunque es muy peque帽o no importa! Los jugos, caf茅, el aroma del lugar... me encanto! Todo muy rico y exquisito  Es Bue...",5.0,Que Seria de M铆,4.5
"Prob茅 barra fr铆a (porqu茅 soy Sinaloense, y en nuestra tierra esa es la especialidad) ... Aguachile combinado, muy basto y rico. Tostada mitotera es personal per...",5.0,Camaron Guasave帽o,5.0
"Los alimentos est谩n bien, nada extraordinario para el tiempo de espera (40 min aprox), fuimos a desayunar. El caf茅 estaba muy tibio. Lo que s铆 est谩 muy rico es...",3.0,Maque,4.0
"Totalmente malinches :( fui en domingo, en plan de desayuno dominical 10 am, 茅ramos los 煤nicos mexicanos, mal servicio, tuvimos que elegir nuestra mesa, esperar...",4.0,El Balc贸n del Zocalo,4.5
"He ido 4 veces es un must to go cuando vienes a la Ciudad de M茅xico ... la infraestructura, las colecciones por piso... y ahora la puerta del infierno ... recom...",4.0,Museo Soumaya,4.5
Tienen el saz贸n de unos buenos mariscos  sinaloenses!! Y se trajeron las torres.. que ser谩n para la pr贸xima visita!! Recomendados! ,4.0,Mariscos Chayito,3.5
"Me toc贸 probar lo Fish  porqu茅 lo visit茅 en pascua... Atenci贸n y Servicio excelente, tiempo de espera para mesa (ten铆amos reservaci贸n) 5 min, porciones ...",4.0,Puerto Madero Polanco,4.5
"Atenci贸n y servicio del personal c谩lido, atentos y amables!! Sabor, calidad y presentaci贸n de los platillos la verdad son muy ricos い!! Solo que creo deb铆 pedi...",4.0,Azul y Oro,3.5
"Un hotel que cumple su funci贸n de s贸lo dormir, ba帽o con agua caliente, y estar bien ubicado! Cuenta con estacionamiento! El elevador mmmh funciona cuando puede...",3.0,Hotel Montemar,3.0
"Es un hotel nuevo por lo tanto esta en excelentes condiciones, cuenta con habitaciones amplias, camas c贸modas, minisplit, abanico de techo, closet amplio, lo me...",4.0,Punto Madero Hotel & Plaza,4.0
"Hablando de restaurants de cortes de carne, en mi experiencia uno de los mejores que tiene Culiac谩n (aunque no hab铆a Bife de Chorizo que es uno de mis preferido...",5.0,Mochomos Culiac谩n,4.5
"Un restaurant que debes visitar si vienes a Mazatl谩n, Culiac谩n, Los Mochis o Escuinapa Sinaloa!! Sabor exquisito, platillos suficientes variados y su panader铆a ...",5.0,Panama,4.5
"Definitivo si gustas un buen ""caf茅 de la olla"" en cualquier sucursal de las 5, lo vas a degustar, en cuanto a la calidad y presentaci贸n de los alimentos, la ate...",3.0,El Gallito,4.0
"Es un restaurant-bar que tiene promociones TODA la semana, la calidad y presentaci贸n de los alimentos es buena, acepta tarjetas de cr茅dito y d茅bito! Y es una bu...",4.0,FULL HOUSE BURGERS SALADS AND WINGS,4.0
"Pizzas  a la le帽a  exquisitas, lo que usualmente recomienda probar!! Pero en general Lo que ordenes de la carta tiene buen sabor y cantidad!! Tiene Buen s...",4.0,El Caprichito Pizzas & tapas,4.0
"Primera vez que lo visito! Y dicen que las primeras impresiones son buenas y fue buena !! La atenci贸n del personal, la calidad y el sabor del sushi  me gu...",4.0,Enji sushi & drinks,4.5
