"We arrived on a Friday at 6pm, probably one of the busiest times of the week, with couples and groups grabbing a meal before shows or other nights out. There wa...",5.0,W London,4.0
"After a miserable hospital visit, my husband's suggestion of 'breakfast at The Bell' was inspired. His illness means that we haven't been to the newly renamed T...",5.0,Toby Carvery Southend,3.5
I've been here for two family parties now and the restaurant manages to deliver excellent food while maintaining a family atmosphere. Route5 is also very popula...,5.0,Route5,5.0
I visited the church for the first time on the City Tour of Puerto Vallarta (which I would also recommend). The tour whisks you through the sights of PV in typ...,5.0,Parroquia de Nuestra Señora de Guadalupe,4.5
We loved this trip. The catamaran is comfortable and stable with open sides all round so nobody on the boat felt queezy. On the way to the islands we had brea...,5.0,Islas Marietas,4.5
"We've just returned from a fortnight at this great resort. As an older couple on our first trip to Mexico, we were naturally apprehensive, but for two weeks we...",5.0,Now Amber Puerto Vallarta Resort & Spa - All Inclusive,4.5
"Fantastic for art, culture, shopping, eating and sea views. Not a long walk but good for half a day at least.",5.0,Malecón Boardwalk,4.5
"This is, without a doubt, the nicest place I've stayed. Hastings was bathed in sunlight this weekend and looking clean and prosperous, but even on a traditional...",5.0,Hastings House,5.0
"I visited Zurich on family business and needed somewhere secure, clean and economical as a base. Casa Heinrich was perfect for my needs. My room was small, but...",4.0,Casa Heinrich Guesthouse,2.5
"I wasn't shopping while I was in Zurich, but the old town was great to wander through, with quaint shops, churches and restaurants. Some of the streets are ver...",5.0,Old Town,4.5
"Sadly we didn't have time to walk to the cable car, but we had a lovely afternoon taking the train up the mountain, walking to the viewing platform and enjoyin...",5.0,Uetliberg Mountain,4.5
"We were welcomed aboard by the fearsome Captain Blackheart and the 'Grafter', both in full period costume. Despite his obvious enthusiasm, no children were ter...",5.0,Golden Hind Museum Ship,4.5
