"El cuarto cuando llegamos olía a cigarro, a pesar de que se supone no es permitido fumar. El hotel tiene alfombra, pero le da un aspecto como de viejo, creo que...",3.0,HS HOTSSON Hotel Tampico,4.0
"Everything in Banyan Tree is perfect! The food, beach, service, pool, spa, everything is great! I really enjoy riding in a bike everyday, walk on the beautiful ...",5.0,Banyan Tree Mayakoba,5.0
"I spent a great week in Hotel W Punta de Mita, everything was excellent, starting from the service in all areas, the pool was really nice, the food excellent, b...",5.0,W Punta de Mita,4.5
"The visit to this wonderful place was amazing, you will be able to see dolphins on your way to the island, you can snorkel and see a lot of reef and beautiful f...",5.0,Islas Marietas,4.5
"Everything was perfect at the hotel, the service is incredible, the garden pool village is very private and romantic, the quality of the restaurants is just ama...",5.0,NIZUC Resort and Spa,4.5
"Los pros: Muy buena atención del personal, en especial JC, Robert, Woody, Damarys y Margarita Las instalaciones muy buenas, muy bien cuidadas y muy limpias Exce...",4.0,Sanctuary Cap Cana,4.5
"Esta rico pero es mucha comida, tienes que estar dispuesto a comer de todo por que a mi esposa no le gustó mucho, por falta de opciones, saludos",4.0,Nos Ancêtres Les Gaulois,3.5
