"Es un bonito lugar, esta en un complejo privado muy seguro en el cual puedes salir a caminar o dan tours (por parte del hotel) en bicileta muy agradable, he ten...",4.0,Dreams Puerto Aventuras Resort & Spa,4.0
"Me encanto el parque, realmente vale la pena, no te pierdas el recorrido de los rios son geniales, primero realiza las actividades acuáticas y luego ya recorre ...",5.0,Experiencias Xcaret,4.5
"Fue muy grato el hospedarnos en este hotel, la atención del personal es muy buena, la comida tiene un buen sazón, la alberca es limpia, una excelente ubicación ...",4.0,Friendly Vallarta All Inclusive Family Resort & Convention Center,4.0
"Me gusto la vista, tuve la oportunidad de ver delfines, pude hacer snorkel, dentro de la isla es un increíble lugar, lo único malo es q no se puede estar mucho ...",5.0,Islas Marietas,4.5
"Es un bonito lugar, te encuentras varias esculturas en el recorrido que te permiten admirar el paisaje, asi como varios bares donde refrescarte tras la caminata...",5.0,Malecón Boardwalk,4.5
Particularmente no soy fanático de las estructuras religiosas pero acompañe a mi esposa a visitar esta parroquia y es particularmente hermosa y detallada.,4.0,Parroquia de Nuestra Señora de Guadalupe,4.5
"Vale la pena tomarse una tarde para darse una vuelta, se encuentra el folklore de la cultura en este lugar... la gente muy amena.",4.0,El Centro,4.5
"Es un increíble lugar, todas las instalaciones en general, la amabilidad y profesionalismo del personal te hace sentir muy especial... desde el momento en que u...",5.0,Dreams Huatulco Resort & Spa,4.5
