"La Jolla Cove, llegar hasta San Diego fue medio una odisea, con el autobús sin embargo llegar a esta playa fue hermoso, un lugar para visitar y relajarse un aca...",4.0,La Jolla Cove,4.5
"Santa Cruz Main Beach, muy lindas las playas de Santa Cruz, mucha gente que va a surfiar, si esta lleno de gente en verano pero si lo recomiendo para pasar un d...",5.0,Santa Cruz Main Beach,4.0
"Rest Haven Motel, el hotel es básico pero esta bien sobre todo si te quedas una noche, el servicio estaba bien, la habitación es normal, el de la recepción nos...",3.0,Rest Haven Motel,3.5
"Pacific Valley Bluff Trail, seguimos con la ruta 1, que muestra toda la parte del Pacífico, la ruta da un poco de vuelras, y te mareas porque va en un zic Zac y...",4.0,Pacific Valley Bluff Trail,4.5
"Monterey Bay, hermoso para hacer la ruta 1, que recorre toda la costa de California la parte de Monterrey es increíble, no tengo palabras para decir lo hermoso ...",5.0,Monterey Bay,4.5
"Puente Golden Gate, Otra parada obligatoria de San Francisco, tiene un mirador bien arriba, tienes que ir en auto, donde podés sacar grande fotos, no hay much...",5.0,Puente Golden Gate,4.5
"Alcatraz, es la segunda vez que voy y me sigue encantando, nunca hay tickets así que lo que recomiendo que los compras online con tiempo, si no tienen que irse ...",5.0,Alcatraz,4.5
"Observatorio Griffith, es donde se puede ver una vista panorámica del cartel de Hollywood, tiene estacionamiento que no es gratis, hay algunas actividades que ...",4.0,Observatorio Griffith,4.5
"Hollywood Walk of Fame, recorrido obligatorio, es donde está todos las estrellas en el suelo con el nombres de los famosos, el camino está divertido para recor...",4.0,Hollywood Walk of Fame,3.5
"Hotel Beresford, el hotel fue un horror, la verdad que el trato con la gente es horrible el desayuno a medio pelo, en un momento habíamos entendido que teníamo...",2.0,Hotel Beresford,3.5
"Little Italy, amo!!! es la segunda vez que voy y la realidad es que es un lugar que amo! muy bien cuidado, ambientado y pintoresco, con una gastronomía incre...",5.0,Little Italy,4.0
"West Beach Inn, a Coast Hotel, es un hotel buenísimo para pasar una o dos noches, tiene desayuno, que esta muy completo, está muy cerca del mar, nos trataron...",5.0,"West Beach Inn, a Coast Hotel",4.5
"Hollywood Sign, Es una parada obligatoria, donde tenés que ir si o si, estando en LA. se puede ver muy bien desde las vistas panoramicas, donde fuimos en auto...",5.0,Hollywood Sign,4.0
"Lake Hollywood Park, fuimos en auto hasta hasta la parte de más alta, para poder sacar mejores fotos, si no vas en auto está un poco complicado, hay que ir en ...",4.0,Lake Hollywood Park,4.5
"California Pizza Kitchen, increíble las pizzas de este lugar, relativamente barato tienen opciones vegetarianas, tragos muy ricos, nos atendieron súper bien, am...",5.0,California Pizza Kitchen Santa Monica,4.0
"Hermoso Santa Bárbara!! el muella y el puerto es hermoso, es un pueblo chiquitito pero muy lindo, su costa es muy linda, tiene una playa blanca, podés pasear ...",5.0,Stearns Wharf,4.0
"Magnolia Bakery, es una confiteria increíble, para desayunar o merendar la verdad que todo lo que tienen está buenísimo, podés ver cómo hacen las tortas, los ...",4.0,Magnolia Bakery,4.5
"Citadel Outlets, llegamos justo en el black friday era una locura de gente, horas de cola para entrar a los locales, pero el lugar es súper barato para comprar...",3.0,Citadel Outlets,4.0
"The Ivy, es un restaurante de alta gamma, la comida es muy rica y cara, vale la pena, todo super limpio, me senti un poco incomoda porque estabamos vestidos muy...",3.0,The Ivy,4.0
"The Cheesecake Factory, uno de los mejore restaurantes que hay, bueno sobre todo por su variedad de cheesecake, lo que más tienen para vegetarianos son alguno...",5.0,The Cheesecake Factory,4.5
"Beverly Center, es uno de los centros comerciales que están en Los Ángeles, tiene como cuatro o cinco pisos, llenos de marcas de ropa, tiene muy pocos lugare...",4.0,Beverly Center,4.0
"The Grove, es un lugar súper lindo, limpio, está lleno de shoppings y bueno obviamente para consumir, varios restaurantes, es un lugar muy agradable esta Nike,...",5.0,The Grove,4.5
"Beverly Laurel Motor Hotel, esta increíble la verdad, los empleados super amabales, todo impecable, súper limpio, hay una pileta, que no la pudimos disfrutar m...",5.0,Beverly Laurel Motor Hotel,4.0
"Warner Bros. Studio Tour Hollywood, Lo mejor que me pasó en la vida, agradezco mucho a los estudios por este momento, gracias por poder conocer el estudio dond...",5.0,Warner Bros. Studio Tour Hollywood,4.5
"Motel 6 Las Vegas - Tropicana, tiene muy buena ubicacion, se encuentra cerca de las vegas boulevard, es bastante economico y tiene desayuno. hay un pileta. Lava...",4.0,Motel 6 Las Vegas - Tropicana,3.5
"Hard Rock Cafe, Siento que son todos iguales si tienen poco más de lo mismo obviamente que mucho más caro que otros lugares, pero no deja de ser la típica el tí...",4.0,Hard Rock Cafe,4.0
"Coca-Cola Store Las Vegas, Es un lugar que es para fanáticos de coca cola en definitivamente es increíble la coca gigante que tienen, sin embargo no me pareció ...",3.0,Coca-Cola Store Las Vegas,4.5
"M&M'S World Las Vegas, pase de casualidad, no podia creer edificio tenía cuatro pisos en las cuales había una variedad de m&m hasta había un auto de nascar en...",5.0,M&M'S World Las Vegas,4.0
"Fuentes del Hotel Bellagio, Super imponente para ver el juego de luces que tiene dentro del agua. Super recomendable para verlo de día como también de noche un...",5.0,Fuentes del Hotel Bellagio,4.5
"Fremont Street Experience, El lugar es increíble una cantidad de pantallas, bares , restaurantes, casinos una cantidad de juegos de luces increíbles, hay un ...",5.0,Fremont Street Experience,4.0
"recoemiendo el 7 eleven para poder comprar comida al pasar y barata, quizas no sea de lo mejor, pero al paso esta perfecto, pizza 2x1 y ale agua siempre sale ma...",4.0,7-Eleven,4.0
"Una buena alternativa barata para desayunar o merendar, ya que varios restaurantes son muy caros, aca podes tomar los tipicos bebidas de starbucks, ademas tiene...",3.0,Starbucks at Bellagio,4.0
"Wynn Las Vegas Casino, uno de los mejores casinos que fui, super elegante y gente super amable, su decoracion es de lujo, recomiendo que pasen por ahi",4.0,Wynn Las Vegas Casino,4.5
"riquisima pizza para disfrutar despues de unas largas caminatas! super recomiendo la de muzzarella, y dentro de todo es barato",4.0,Little Italy Pizza,3.5
"Bellagio Conservatory & Botanical Garden, es un lugar increíble llegue de casualidad, caminando por diferentes hoteles, al llegar me encanto la temática de las...",5.0,Bellagio Conservatory & Botanical Garden,4.5
"mirador de la torre eiffel, tiene una hermosa viste, dentro de todo sale bastante barato, se puede ver el show de las fuentes del Bellagio, como el paseo de str...",5.0,Mirador de la Torre Eiffel en Paris Las Vegas,4.0
pizza italiana a la orden! super recomiendable para disfrutar una buena pizza despues de largas caminatas! el lugar no es tan conocido asi que aprovechen para p...,4.0,Sicilian Pizza,5.0
"the strip, Si es tu primera vez en las Vegas tenés que hacer este paseo, yo lo hice de día y de noche tambien, fue muy lindo está lleno de hoteles y casinos de ...",4.0,The Strip,4.5
"Las vegas hostes es un lugar bastante lindo para hospedarse, tengan en cuenta que es muy economico y tiene desayuno, pileta y aire acondicionado, eso suma mucho...",3.0,Las Vegas Hostel,3.0
La Bonfil es un restaurante que queda cerca bueno queda sobre Álvaro Obregón en la Roma el lugar es muy lindo muy acogedor barato el guacamole es riquísimo y ti...,5.0,La Bonfil,5.0
