"Muy recomendado, excelente servicio, te atiende de maravilla...cumplidos, agradables...definitivamente es una buena experiencia viajar con ellos",5.0,Marlin Espadas,3.0
El único lugar en la isla que cuenta con Paddle Board experiencia inolvidable y a lado del mejor maestro Toño...si vas a la isla buscalo es muy cheveré....ademá...,5.0,Green Monkey Hostel,3.0
Si se te agotaron las opciones y tienes ganar de dar un paseo tranquilo está es la opción....no es la gran cosa pero es muy tranquilo para ver la vista la mar y...,3.0,El Malecón de Chetumal,4.5
Yo soy muy exigente con los show en general (soy actor) pero en realidad este show que se han montado estos brothers en verdad me deja con el ojo cuadrado...me ...,5.0,Parque Xcaret,4.5
Comida algo parecida a la mexicana pero obligación pararte para probarlas...baratísimas y de gran calidad...además todos están ahí tiene muy buen ambiente,4.0,Las Mesitas,4.5
"Gran lugar, otra gran ciudad maya...un lugar demasiado grande...te recomiendo ir todo el día...(y ni aún así creo que te lo termines), recuerda que es selva así...",4.0,Tikal National Park,40.4
"Recomiendo hacer el tour por tu lado, salen varias lanchas y te ofrecen el tour a mucho más económico y es lo mismo que si tomarás el tour desde Puerto Vallarta...",5.0,Islas Marietas,4.5
A mi que me encanta escalar y subir me fascino estas estructuras....son esculturas únicas en medio de la pequeña selva...un trabajo realmente excepcional...sien...,5.0,Jardín Escultórico Edward James,4.5
"Realmente no hay mucho que ver aquí en este embarcadero, de aquí se parte para las cascadas de Tamul.",3.0,Embarcadero La Morena,4.5
Casualmente nos topamos a un chico húngaro que nos recomendó visitar estás cascadas las cuales yo no conocía y como que no me daban ganas de ir...Una vez estand...,5.0,Cascada de Tamul,5.0
"Realmente esperaba más de este lugar....a pesar de que tiene lindas pirámides...es un lugar no tan maravillante como Chichen Itza, Tikal o Tehotihuacan. Creo qu...",2.0,Zona Arqueológica El Tajín,5.0
"Es bueno para los fanáticos del futbol, y no tan fanáticos...puedes recorrer el estadio desde los vestidores, hasta la cancha pasando por la sala de prensa, los...",3.0,Estadio Azteca,4.5
"Sin duda un gran campus, imposible no recorrerlo...recomiendo que vayas cuando hay estudiantes...sentirás el ambiente universitario mexicano, además que podrás ...",5.0,Ciudad Universitaria,4.5
"Gran estructura, te va a maravillar, no lo subestimes...es increíble...te recomiendo en la noche ir a tomar una cerveza en los bares aledaños al Palacio y admir...",5.0,Palacio de Bellas Artes,4.5
"Gran ambiente, toca Mariachi...yo fui practicamente para llevar a mis amigas de Brasil a conocer un poco del mariachi mexicano, el tequila y la buena parranda m...",4.0,La Tequilera Garibaldi,1.5
"No son las grandes ruinas pero te puedo enseñar un poco de la cultura zapoteca, se ve muy padre la vista para la ciudad de Oaxaca...visitalo por la mañana",4.0,Zona Arqueológica de Monte Albán,5.0
"Al principio me lo recomendaron y no daba mucho por el...al entrar....me quede mudo, era fantástico observar el techo, las paredes, la tranquilidad....simplemen...",5.0,Templo de Santo Domingo de Guzmán,5.0
"En verdad es un sitio único y especial, playa bohemia y linda lugar para conocer gente y disfrutar del mar.",5.0,Playa Mazunte,4.5
"A mi parecer es una belleza de la naturaleza, el arbolito que te muestran también es bonito....pero pienso que no es tan maravilloso como creía, aún así es indi...",4.0,Cañón del Sumidero,4.5
"Su gente, la calidad de los productos que venden, su comida (el chocolate más delicioso que he probado en mi vida), su música y casualmente me toco el festival ...",4.0,Templo de San Cristóbal,4.5
"Grandes ruinas arqueológicas, muy buen lugar para explorar...de verdad me gusto bastante, considero que es importante ver las vistas desde arriba de las pirámid...",4.0,Parque Nacional Palenque,5.0
"Fuimos de noche, es un lugar bonito....vimos un baile típico regional que nos maravillo...y claro que comimos la típica cochinita pibil",4.0,Plaza Grande,4.5
"Es una maravilla...desde la atención, muy limpios los cuartos, aire acondicionado bueno, muy buena atención...quede maravillado con este....y lo recomiendo ampl...",5.0,Posada Ya'ax Ich,4.5
"Pueblo con pirámides e iglesias...muy pintoresco, y muy tranquilo....aquí vino el Papa Juan Pablo II y está su estatua en el centro.",4.0,Zona Arqueológica de Izamal,4.0
"Una de las ciudades principales de los mayas, puedes admirar el juego de pelota, entre otras grandes piezas arquitectónicas que nos han dejado los mayas...eso s...",5.0,Zona Arqueológica de Chichén Itzá,4.5
"Debo confesar que no soy mucho de fiestas, pero este lugar a merita que lo visites....se trata del mítico Coco Bongo.... aquí bailar porque bailas y te divierte...",5.0,Coco Bongo Cancún,4.5
Es un mall! Lo que tiene de diferente es como está construido....eso es lo que lo hace atractivo...pero no esperes encontrarte con tiendas exóticas o diferentes...,3.0,La Isla Shopping Village,4.5
"De los mejores servicios que he tenido con aerolíneas, definitivamente me enamore de su servicio, la calidad de lo que ofrecen, su sistema de entretenimiento, s...",5.0,LATAM Chile,4.0
"Es un lugar para ir solo si te gusta ver iglesias y conocer un poco de la historia católica de México, aquí puedes encontrar a la Virgen de Zapopan....lo lindo ...",3.0,Santuario de Nuestra Senora de Zapopan,4.5
"Sinceramente de los mejores lugares que he visto en todo el mundo, realmente es mágico, único y divertido, excelente la comida, el tequila, la diversión. Hacen ...",5.0,El Parian,3.5
"Realmente es muy básico el servicio, en ocasiones tienen retrasos, a veces hasta 2 horas, pero en realidad es aceptable para la clase económica.",3.0,Interjet,3.5
"Muy grande el parque tienes que hacerlo en 2 días mínimo, recomiendo ir a la garganta del diablo primero (a primera hora) y luego disfrutar el resto del parque ...",5.0,Cataratas del Iguazú,5.0
"Un lugar ideal para ver las tres fronteras del Rio Parana (Brasil, Argentina y Paraguay) caminando llegas (claro si te gusta caminar), un lugar muy relajado par...",4.0,Hito Tres Fronteras,3.5
"Es uno de los mejores lugares a los que he podido viajar, estas en lo más alto de la Isla con un volcán inactivo y un cráter enorme, escuchando las historias de...",5.0,Rano Kau,5.0
"Pirámide del Sol y de la luna imperdibles, llévate un sombrero, lentes y protector solar porque hace mucho calor. Es un lugar que debe estar si o si en tu viaje...",5.0,Zona Arqueológica de Teotihuacán,5.0
"Es un lugar algo caro, pero vale la pena comer y ver la ciudad de México, en especial por la tarde para anochecer y con una excelente música. La comida a mi par...",5.0,Bellini Restaurante Giratorio,4.0
"Un lugar muy bonito, muy juvenil y con muchas comodidades, tiene juegos y dan un buen desayuno, te atiende muy bien y dan ganas de volver. Los dormitorios tiene...",4.0,Marcopolo Inn Iguazu,3.5
"Es un lugar alternativo, hecho con madera todo....pero lo que me encanto y me llevo de recuerdo es una señora que tocaba el arpa que me encanto la sencillez, hu...",4.0,La Aripuca,4.0
"Digamos que no es lo mejor del mundo, pero admiras la manera en que el señor ha dedicado su vida al reciclaje, en realidad no es muy turístico pero pues recreat...",2.0,La Casa de Botellas,4.0
"Es un lugar muy importante para los católicos, y un lugar donde se siente una mística padre, recomiendo visitarlo cuando no haya misa ya que se puede llenar, ll...",4.0,Basílica de la Virgen Guadalupe,4.5
