"El viaje privado para seis personas a buen precio, hay que llevar agua o algo de tomar ,paravlas personas que no saben nadar no hay problema con un chaleco y la...",5.0,Islas Marietas,4.5
"El clima excelente, llevar zapatos para mojarlos y poder caminar libremente en le rio de agua caliente, visitar las grutas y mucho animo para pasarla bien , les...",5.0,Grutas de Tolantongo,4.0
"llevar tenis, ropa sport, llegar temprano , hacer el recorrido y puedes visitar San Miguel Regla y Huasca.",3.0,Prismas Basálticos,4.5
"Llevar ropa adecuada para la nieve, zapatos especiales o en su defecto llevar un respuesto de calcetines y zapatos (acabas mojado), se necesita buena condicon f...",5.0,Nevado de Toluca,4.5
"El hotel se encuentra en buen estado, se ve que le estan dando mantenimiento, la alberca buena por que siento que falta limpieza pero bien, la playa del hotel e...",4.0,Hotel Fontan Ixtapa,4.0
"Acabo de regresar de mis vacaciones de una semana , la comida es buena sobre todo el del restaurante italiano solo que llegando reserven igual para el mexicano,...",3.0,Allegro Playacar,4.0
