"Mi esposo solicito un masaje, el cual le fue proporcionado por una mujer mayor, gorda y morena, y en lugar de aplicar un masaje relajante tal y como lo anuncian...",1.0,La Isla Shopping Village,4.5
"En varias ocaciones de los 5 dias que estubimos ahi los huespedes superaron al personal por lo que no se daban abasto, la comida muy rica, tambien la amabilidad...",4.0,Plaza Pelicanos Grand Beach Resort,4.0
"La verdad es uno de los malecones que mas me gustan de mi Mexico querido, es limpio, tiene una vista a la bahia explendorosa, uno de los lugares mas hermosos de...",5.0,Malecón Boardwalk,4.5
"Es un lugar encantador, unico en Puerto Vallarta, hiba mucho pero jamas habia ido a las Islas Marias, me encanto, deben de disfrutar las bellezas naturales que ...",5.0,Islas Marietas,4.5
"El Pueblo de Puerto Vallarta es de ensueño, sus calles empedradas, su Iglesia Icono del pueblo, me encanta ir de compras el mercado es fabuloso, despues pasear ...",5.0,El Centro,4.5
"Una parte de los mas bonito del antiguo Vallarta, sus calles, sus restaurant y cafe, toda esta zona es muy turistica pero hay que detenerse a observar sus const...",5.0,Zona Romántica,4.5
"Este hotel tiene que ser revisado por la Secretaria de Turismo, las habitaciones estan asquerosas e insalubres, entregan la habitacion si haberlas aseado, teni...",1.0,Hotel Sevilla,3.5
