"Hermosa playa, agua clara y tonos verdes y azul claro, la vista es impresionante con los cerros y hacia el mar la isla. Super recomendado para ir con niños, hay...",5.0,Playa El Tecolote,4.5
"Fuimos en familia, es un lugar acogedor y se nota que está orientado hacia los locales más que hacia los turistas por lo que los precios son accesibles, super r...",5.0,Mariscos Mazatlan,4.5
"El hotel nos sorprendió gratamente, rentamos una habitación para 4 adultos y era un departamento entero con dos habitaciones dos baños, sala, cocina equipada y ...",5.0,Sunrock Condo Hotel,4.5
"Fuimos con espectativas buenas y el hotel las superó, todas las instalaciones lucen modernas y cuidadas, habitaciones super cómodas, de tamaño regular, cuentan ...",5.0,Hotel Santa Fe Los Cabos by Villa Group,4.0
"Buen hotel a 5 minutos en auto del centro de la Paz, habitación de regular tamaño, limpia, aire acondicionado, alberca, volveríamos sin duda, ideal si vas en au...",4.0,Hotel Hacienda Bugambilias,3.0
"El lugar es ameno, los meseros muy atentos, la variedad de la comida buena y el bufete te sirven de todo las veces que quieras. Precio de las bebidas 30 pesos, ...",4.0,El Rescoldo Buffet,3.5
"Es una burla para el turismo nacional que te quieran cobrar $1,500 por persona por estar 20 minutos en la playa del amor en las islas marietas, en vallarta me c...",1.0,Islas Marietas,4.5
"Buen hotel, tiene un buen costo en relación a lo que encuentras, las habitaciones bien, aire acondicionado, balcón, tv led, falta renovar el mosaico de los baño...",4.0,San Marino Hotel,3.0
Lo único que se puede decir es que el museo ya no existe. Lo clausuró grupo modelo. O mejor dicho la nueva compañía extranjera que ahora es dueña de grupo model...,1.0,Modelo Museum of Science and Industry,4.0
"Una de las catedrales mas hermosas que he visto, es enorme, una vez que entras parece la dimensionas por completo, ideal para un paseo en pareja o familia.",4.0,Catedral de Toluca,4.5
"Si vas a los cabos, es obligatorio ir al arco, es un lugar hermoso, puedes llegar en lancha que alquilas en la playa, lleva tus bebidas ya que en el arco te ven...",5.0,El Arco de Cabo San Lucas,5.0
"Es una bahia muy grande, con oleaje bajo y agua colores azul y verde, en algunas partes es algo profundo por lo que deben tener cuidado si van con niños o no na...",4.0,Bahía de Cabo San Lucas,4.5
"Entre las mejores playas de los cabos, arena clara y fina, agua azul turquesa, oleaje bajo, poca profundidad, ideal para ir todo un dia a relajarse, si tu presu...",4.0,Playa El Chileno,4.5
"Simplemente imperdible, una de las playas mas hermosas de México, arena blanca, agua azul turquesa, puedes caminar mar adentro unos 200 metros y el nivel del ag...",5.0,Playa Norte,4.5
"Hermosa playa de arena blanca y con el encanto del caribe, puedes llegar en taxi o rentando un auto o moto, visitas el faro, los cocodrilos, ademas puedes esnor...",5.0,Punta Sur Eco Beach Park,4.5
"Grandioso lugar, muy recomendable es facil llegar y muy economico, consejo: busquen un guía ya que vale mucho la pena la explicación de los vitrales y la histor...",4.0,Cosmovitral Jardín Botánico,4.5
"Riquisimas tortas, el lugar es super concurrido, traten de llegar con tiempo y buscar lugares para sentarse.",5.0,La Vaquita Negra Del Portal,3.5
"Es un hotel recomendable si quieres salir y tomar los tours en cancun, habitaciones confortables, comida rica (llevaba el paquete solo con desayunos). EL mar en...",3.0,Ocean View Cancun Arenas,3.5
"Uno de los mejores hoteles en la mejor playa de cancun y a un costo accesible, las habitaciones limpias y espaciosas, la vista al mar es hermosa. el personal am...",5.0,Hotel Flamingo Cancun Resort,3.5
está ubicado en una de la mejores playas de Ixtapa ya que es una bahía y no hay oleaje fuerte el arrecife y cocodrilario están muy cerca. las habitaciones son d...,5.0,Qualton Club Ixtapa,3.5
"Excelente hotel, habitaciones confortables, espaciosas y con todas las comodidades, todas ellas tienen vista al mar, la comida exquisita ya que es a la carta, e...",4.0,El Cid La Ceiba Beach Hotel,4.0
"EL hotel superó mis expectativas, totalmente céntrico (5 mins en camión del centro de San José), a 2 cuadras de la parada de camión que te lleva a aeropuerto y ...",4.0,Posada Real Los Cabos,4.0
